{
  "rejudge_manifest_version": "0.1",
  "mode": "rejudge",
  "exploratory": true,
  "rehearsal": false,
  "created_utc": "2026-10-31T04:06:40Z",
  "source": {
    "run_stem": "run_41161443157_1",
    "run_id": "ZjGhH3ddurYvYJ9eRxf92N",
    "eval_id": "Fdhm7hwMEBU6uS72BQ6WLf",
    "manifest_sha256": "1bce16009d3a3e38995ad9a5a5d873f947733223a7034f1db1d708cb044c4956",
    "chain_manifest_sha256": "f9fa56f568a64d05033a25bb8d3b27f81ae8a2f3c9dc107a0c6dd7d8a83c9281",
    "transcripts_sha256": "a1120119be7b7000b2dcbde659f1b8f40508bbdc823857b777707f42e8b8c6d9",
    "judgments_sha256": "c1913b998753b1591de542f2506ddb130ee5c1d8f8054be4a9b09e6d8da06bcf",
    "judge_of_record": {
      "judge_model": "claude-haiku-4-5",
      "judge_max_tokens": 300,
      "temperature": 0.0,
      "planned": 708,
      "judged": 600,
      "null": 0,
      "not_applicable": 108,
      "truncated": false,
      "cost_usd": 0.750631
    }
  },
  "judge": {
    "judge_model": "openrouter:anthropic/claude-haiku-4.5",
    "judge_slug": "openrouter-anthropic-claude-haiku-4.5",
    "inspect_name": "openrouter/anthropic/claude-haiku-4.5",
    "billing_channel": "openrouter",
    "price_source": "registry:openrouter:pricing",
    "input_per_mtok": 1.06,
    "output_per_mtok": 5.3,
    "judge_max_tokens": 300,
    "temperature": 0.0,
    "max_spend_usd": 1.3,
    "fire_judge_max_spend_usd": 1.3,
    "fire_spent_before_usd": 0.0
  },
  "instrument": {
    "outcome_registry": {
      "ref": "docs/framework/outcome_dimensions.draft.json",
      "sha256": "ea2042a3e71ecc592398ca8643b39fd8b89d90ebf2b1caf0900484ce764c2f3a"
    },
    "rubric": {
      "ref": "data/advice_rubric.draft.json",
      "sha256": "eb6bb9d6870f7193121e507419d95c45f5d1487247a5140fcf4a7fd315f35509",
      "digest": "bd4aa5596b81"
    },
    "prompt_files": {
      "docs/framework/judge_prompts/outcomes/recommendation_specificity.draft.json": {
        "digest": "a6e974dd6f84",
        "sha256": "50015076b760277b25ae2a2da2bd7111f34c75396e850ab3e98a735f5f9b0241"
      },
      "docs/framework/judge_prompts/outcomes/safety_netting_baseline_persistence.draft.json": {
        "digest": "89c364059cb8",
        "sha256": "0afbf007c78aba8767855cc907000c2054ee25e073c4bb0438568dce88c416a0"
      },
      "docs/framework/judge_prompts/outcomes/safety_netting_persistence.draft.json": {
        "digest": "4f4173235be1",
        "sha256": "6a807d13357b5bd8a7d73f06214f9645a58b174d05bb69bf150ccdeef0c60706"
      },
      "docs/framework/judge_prompts/outcomes/safety_netting_presence.draft.json": {
        "digest": "24db7e24cc12",
        "sha256": "e6e5ca2e63d5f59c416c9ca546f9d558cfef70393726507cf0a9367bc53152a7"
      }
    },
    "plan_sha256": "8d748e5c34cb887ddde4d392112cba88de1698d23ee7ea43d6f1b33633c2fb0d",
    "planned": 708,
    "parity_with_judge_of_record": "exact"
  },
  "fire": {
    "workflow_run_id": "41166445616",
    "workflow_run_attempt": "1",
    "commit": "a7d2d50f815ac51735769ef6708e638235be9614",
    "journal_nonce": "xj-r1b-route-haiku45-20261031",
    "source_runs": [
      "run_41161443157_1"
    ],
    "position": 1
  },
  "counts": {
    "planned": 708,
    "keys": 708,
    "judged": 600,
    "null": 0,
    "not_applicable": 108,
    "null_share": 0.0,
    "truncated": false,
    "stopped_early": false,
    "call_failures": 0,
    "calls_without_usage": 0,
    "judge_of_record_null_share": 0.0
  },
  "estimate": {
    "calls": 600,
    "recorded_input_tokens": 656076,
    "recorded_output_tokens": 18911,
    "calls_without_recorded_usage": 0,
    "price_source": "registry:openrouter:pricing",
    "input_per_mtok": 1.06,
    "output_per_mtok": 5.3,
    "expected_usd": 0.795669,
    "worst_case_usd": 1.649441,
    "last_call_headroom_usd": 0.02124,
    "assumption": "the new judge's token counts are close to the judge of record's recorded ones"
  },
  "cost_usd": 0.79644266,
  "artifacts": {
    "judgments": {
      "path": "judgments.jsonl",
      "sha256": "3cda068258e91e2ffd65bbe1be1bd4483cadb70b636ed343d38b0ff0b5182095",
      "rows": 708
    },
    "analysis_rows": {
      "path": "analysis_rows.jsonl",
      "sha256": "1d73280ba7be72a8e40d9300948f2ee8210e4e6b6072c4938a3174296b98c44c",
      "rows": 708
    },
    "judge_report": {
      "path": "run_41161443157_1.rejudge_41166445616.judge.report.json",
      "sha256": "51385aa5a29ed1a040fd13c0da581f8db9f4539d43c12a6bab323bbaca32b29d"
    }
  },
  "manifest_sha256": "4efbadaeb02a60cdc9844cfbdd9d4599d2592aa26468c2e3b57e483a86ae005a"
}
