{
  "rejudge_manifest_version": "0.1",
  "mode": "rejudge",
  "exploratory": true,
  "rehearsal": false,
  "created_utc": "2026-10-31T06:50:32Z",
  "judge_role": "secondary",
  "source": {
    "run_stem": "run_35937014168_1",
    "run_id": "Qew9x4GDsaLdAK2BWmotBN",
    "eval_id": "AnkqfQkzL3YVAR7LECKABf",
    "manifest_sha256": "a075f9f987df4e869d93e1cb52cc61aec98adb9edbc6dd17d05f5e949ba84526",
    "chain_manifest_sha256": "e6d4d287cd378c0369b7375f87931889d248a136f5e0c34b15285befcae0bf0d",
    "transcripts_sha256": "4535759d05dd0a4fecd318d613fba13eaab05d073380ae20ae7ff7a363083216",
    "judgments_sha256": "d6669684cc5750d91e1e3b06d1c3e9297ea4d196173bd63132e67db0cce7878b",
    "judge_of_record": {
      "judge_model": "claude-haiku-4-5",
      "judge_max_tokens": 300,
      "temperature": 0.0,
      "planned": 1595,
      "judged": 1370,
      "null": 4,
      "not_applicable": 221,
      "truncated": false,
      "cost_usd": 1.626861
    }
  },
  "judge": {
    "judge_model": "openrouter:anthropic/claude-haiku-5.5",
    "judge_slug": "openrouter-anthropic-claude-haiku-5.5",
    "inspect_name": "openrouter/anthropic/claude-haiku-5.5",
    "billing_channel": "openrouter",
    "price_source": "registry:openrouter:pricing",
    "input_per_mtok": 0.106,
    "output_per_mtok": 0.53,
    "judge_max_tokens": 300,
    "temperature": 0.0,
    "max_spend_usd": 0.43552305,
    "fire_judge_max_spend_usd": 0.6625,
    "fire_spent_before_usd": 0.22697695,
    "temperature_sent": null,
    "temperature_omitted": "OpenRouter spelling of claude-haiku-5-5; omit the non-default sampling parameter as on the direct route (R4, 2026-10-15).",
    "thinking_sent": "disabled",
    "thinking_disabled": "OpenRouter Petri judge sends reasoning.effort none and provider.require_parameters true; https://openrouter.ai/docs/guides/best-practices/reasoning-tokens (verified 2026-10-15). The small judge allowance is for the answer, so reasoning must be disabled, not merely excluded from the returned content."
  },
  "instrument": {
    "outcome_registry": {
      "ref": "docs/framework/outcome_dimensions.draft.json",
      "sha256": "ea2042a3e71ecc592398ca8643b39fd8b89d90ebf2b1caf0900484ce764c2f3a"
    },
    "rubric": {
      "ref": "data/advice_rubric.draft.json",
      "sha256": "eb6bb9d6870f7193121e507419d95c45f5d1487247a5140fcf4a7fd315f35509",
      "digest": "bd4aa5596b81"
    },
    "prompt_files": {
      "docs/framework/judge_prompts/outcomes/assertion_handling.draft.json": {
        "digest": "abb134e894c7",
        "sha256": "17216669b54093a136a850619d44dfee1c2dcc169b36891d907231f7b49d4598"
      },
      "docs/framework/judge_prompts/outcomes/recommendation_specificity.draft.json": {
        "digest": "a6e974dd6f84",
        "sha256": "50015076b760277b25ae2a2da2bd7111f34c75396e850ab3e98a735f5f9b0241"
      },
      "docs/framework/judge_prompts/outcomes/referral_specificity.draft.json": {
        "digest": "a9c0a680e6f8",
        "sha256": "8087d0c089cba808c194cfecbb885d8aac291b5190950a904c6b920843a2cede"
      },
      "docs/framework/judge_prompts/outcomes/safety_netting_baseline_persistence.draft.json": {
        "digest": "89c364059cb8",
        "sha256": "0afbf007c78aba8767855cc907000c2054ee25e073c4bb0438568dce88c416a0"
      },
      "docs/framework/judge_prompts/outcomes/safety_netting_persistence.draft.json": {
        "digest": "4f4173235be1",
        "sha256": "6a807d13357b5bd8a7d73f06214f9645a58b174d05bb69bf150ccdeef0c60706"
      },
      "docs/framework/judge_prompts/outcomes/safety_netting_presence.draft.json": {
        "digest": "24db7e24cc12",
        "sha256": "e6e5ca2e63d5f59c416c9ca546f9d558cfef70393726507cf0a9367bc53152a7"
      },
      "docs/framework/judge_prompts/outcomes/tool_evidence_use.draft.json": {
        "digest": "9b602c4c77cb",
        "sha256": "ee20eb0e0a2bdc2541466092f6d044bddf9695e2f8e2be720c98f1d32823f743"
      }
    },
    "plan_sha256": "a946382a4a2470ce3d05dcb83405367ad7175d2eb3edab3a2d2c0c8e18e32786",
    "planned": 1595,
    "parity_with_judge_of_record": "exact"
  },
  "fire": {
    "workflow_run_id": "41168177397",
    "workflow_run_attempt": "1",
    "commit": "fbc4589ae2d293b8e30e97eea42a2e05d8c5661b",
    "journal_nonce": "xj-r3-w2-gpt54mini-20261031",
    "source_runs": [
      "run_35812312136_1",
      "run_35937014168_1",
      "run_36076994201_1"
    ],
    "position": 2
  },
  "counts": {
    "planned": 1595,
    "keys": 1595,
    "judged": 1313,
    "null": 61,
    "not_applicable": 221,
    "null_share": 0.044396,
    "truncated": false,
    "stopped_early": false,
    "call_failures": 0,
    "calls_without_usage": 0,
    "judge_of_record_null_share": 0.002911
  },
  "estimate": {
    "calls": 1374,
    "recorded_input_tokens": 1377641,
    "recorded_output_tokens": 49844,
    "calls_without_recorded_usage": 0,
    "price_source": "registry:openrouter:pricing",
    "input_per_mtok": 0.106,
    "output_per_mtok": 0.53,
    "expected_usd": 0.172447,
    "worst_case_usd": 0.364496,
    "last_call_headroom_usd": 0.002133,
    "assumption": "the new judge's token counts are close to the judge of record's recorded ones"
  },
  "cost_usd": 0.22908519,
  "artifacts": {
    "judgments": {
      "path": "judgments.jsonl",
      "sha256": "5de717b3ac412ae63f2cc94c12e0befffa468d118f4b9f4ee1e3f3db8af0135b",
      "rows": 1595
    },
    "analysis_rows": {
      "path": "analysis_rows.jsonl",
      "sha256": "df4feb1a4d192f468f81c1e816d5231c7d410b35509f5603cc57aee2763e4c2e",
      "rows": 1595
    },
    "judge_report": {
      "path": "run_35937014168_1.rejudge_41168177397_secondary.judge.report.json",
      "sha256": "b1f4c3cb29869414057fdda5b14e63bb5853eeca4b2231eb29a49cd8f448d794"
    }
  },
  "manifest_sha256": "336a09fa393ddd52e063d30f8e875699f02aba8cd068602f7503fd874ada095b"
}
