{
  "rejudge_manifest_version": "0.1",
  "mode": "rejudge",
  "exploratory": true,
  "rehearsal": false,
  "created_utc": "2026-10-31T03:47:41Z",
  "source": {
    "run_stem": "run_41162534624_1",
    "run_id": "Jz6F3RQXxER6vthhq2pPLV",
    "eval_id": "WkKbDLRCtnC33bH5gVSuV2",
    "manifest_sha256": "7cfa64110a334f3580c2ef78a04043019968148ecc73b2ea945b2de98e3ad6fb",
    "chain_manifest_sha256": "95ed87fa43734331b6009d4d16fb9ffc7a608a6ac9c286c79436297214cd09ef",
    "transcripts_sha256": "9d6d0ffb1a6bc8ebdd09489083f48987b691f91991ec184cc5a6c97f187b34a8",
    "judgments_sha256": "4a25d7bd054d158b464551b819af1a77dad8ce65165060ad29886e8a3a23cac5",
    "judge_of_record": {
      "judge_model": "openrouter:anthropic/claude-haiku-4.5",
      "judge_max_tokens": 300,
      "temperature": 0.0,
      "planned": 708,
      "judged": 600,
      "null": 0,
      "not_applicable": 108,
      "truncated": false,
      "cost_usd": 0.927235
    }
  },
  "judge": {
    "judge_model": "openrouter:openai/gpt-5.4-mini",
    "judge_slug": "openrouter-openai-gpt-5.4-mini",
    "inspect_name": "openrouter/openai/gpt-5.4-mini",
    "billing_channel": "openrouter",
    "price_source": "registry:openrouter:pricing",
    "input_per_mtok": 0.8,
    "output_per_mtok": 4.75,
    "judge_max_tokens": 300,
    "temperature": 0.0,
    "max_spend_usd": 1.46510585,
    "fire_judge_max_spend_usd": 2.0,
    "fire_spent_before_usd": 0.53489415
  },
  "instrument": {
    "outcome_registry": {
      "ref": "docs/framework/outcome_dimensions.draft.json",
      "sha256": "ea2042a3e71ecc592398ca8643b39fd8b89d90ebf2b1caf0900484ce764c2f3a"
    },
    "rubric": {
      "ref": "data/advice_rubric.draft.json",
      "sha256": "eb6bb9d6870f7193121e507419d95c45f5d1487247a5140fcf4a7fd315f35509",
      "digest": "bd4aa5596b81"
    },
    "prompt_files": {
      "docs/framework/judge_prompts/outcomes/recommendation_specificity.draft.json": {
        "digest": "a6e974dd6f84",
        "sha256": "50015076b760277b25ae2a2da2bd7111f34c75396e850ab3e98a735f5f9b0241"
      },
      "docs/framework/judge_prompts/outcomes/safety_netting_baseline_persistence.draft.json": {
        "digest": "89c364059cb8",
        "sha256": "0afbf007c78aba8767855cc907000c2054ee25e073c4bb0438568dce88c416a0"
      },
      "docs/framework/judge_prompts/outcomes/safety_netting_persistence.draft.json": {
        "digest": "4f4173235be1",
        "sha256": "6a807d13357b5bd8a7d73f06214f9645a58b174d05bb69bf150ccdeef0c60706"
      },
      "docs/framework/judge_prompts/outcomes/safety_netting_presence.draft.json": {
        "digest": "24db7e24cc12",
        "sha256": "e6e5ca2e63d5f59c416c9ca546f9d558cfef70393726507cf0a9367bc53152a7"
      }
    },
    "plan_sha256": "ef820e0efeadb9642423057e8cddbb7e3d93a6d54fb7a96773a859a62f16b58a",
    "planned": 708,
    "parity_with_judge_of_record": "exact"
  },
  "fire": {
    "workflow_run_id": "41164150682",
    "workflow_run_attempt": "1",
    "commit": "cb39f04ec951d4f09b92a51af55efdfbdfabcfc4",
    "journal_nonce": "xj-r1-eqv2-gpt54mini-20261031",
    "source_runs": [
      "run_41161443157_1",
      "run_41162534624_1"
    ],
    "position": 2
  },
  "counts": {
    "planned": 708,
    "keys": 708,
    "judged": 600,
    "null": 0,
    "not_applicable": 108,
    "null_share": 0.0,
    "truncated": false,
    "stopped_early": false,
    "call_failures": 0,
    "calls_without_usage": 0,
    "judge_of_record_null_share": 0.0
  },
  "estimate": {
    "calls": 600,
    "recorded_input_tokens": 783670,
    "recorded_output_tokens": 18216,
    "calls_without_recorded_usage": 0,
    "price_source": "registry:openrouter:pricing",
    "input_per_mtok": 0.8,
    "output_per_mtok": 4.75,
    "expected_usd": 0.713462,
    "worst_case_usd": 1.481936,
    "last_call_headroom_usd": 0.017489,
    "assumption": "the new judge's token counts are close to the judge of record's recorded ones"
  },
  "cost_usd": 0.6308279,
  "artifacts": {
    "judgments": {
      "path": "judgments.jsonl",
      "sha256": "7c8106cc4176de12dbf1094fe7d72854dbe02d43e42dc8a6ea224af0f1f8c973",
      "rows": 708
    },
    "analysis_rows": {
      "path": "analysis_rows.jsonl",
      "sha256": "f5a6b1cc166b692a7c90b1d1fb673518630fff8520d4f37a7733e62649207e17",
      "rows": 708
    },
    "judge_report": {
      "path": "run_41162534624_1.rejudge_41164150682.judge.report.json",
      "sha256": "1f50febc2beb986e3586faf2eb028f2e5cfdd0a3da392fe304eac2c745deca9a"
    }
  },
  "manifest_sha256": "36fa289851f62ba30a89b4eef849e1c5e43287db7ef4c111ef3d593d3e17823f"
}
